{"authorizations":{"calibration_development_run_authorized":false,"dvc_commands_authorized":false,"dvc_push_authorized":false,"e0_m_authorized":false,"e0_u_authorized":false,"e7_learning_curve_run_authorized":false,"effective_in_payload":false,"git_commit_authorized":false,"git_push_authorized":false,"holdout_access_authorized":false,"locked_evaluation_authorized":false,"outcome_access_authorized":false,"post_2021_access_authorized":false,"scientific_network_authorized":false},"calibration_group_matrix":{"bloom_group_count":66,"bloom_group_key":["model_id","model_seed","horizon_months"],"bloom_group_target_universe_policy":"exact_identity_set_equality_no_partial_groups","bloom_groups_with_exact_complete_target_universe":66,"complete_target_count":2646,"complete_target_counts_by_target_year_horizon":{"2019":{"1":397,"2":371,"3":344},"2020":{"1":261,"2":287,"3":314},"2021":{"1":224,"2":224,"3":224}},"complete_target_identity_key":["source_id","site_id","origin_year_month","target_year_month","horizon_months"],"cross_group_pooling":"no_pooling","horizons_months":[1,2,3],"ordinal_completed_group_count":30,"ordinal_group_count":33,"ordinal_group_key":["model_id","model_seed","horizon_months"],"ordinal_unavailable_cutpoints":null,"ordinal_unavailable_group_count":3,"ordinal_unavailable_model_ids":["B0"],"ordinal_unavailable_status":"not_available_degenerate_constant_score","q_c_levels":[0.8,0.9,0.95],"q_c_record_count":90,"uncertainty_group_count":30,"uncertainty_group_key":["model_id","model_seed","horizon_months"],"uncertainty_model_ids":["A0","A1"]},"e7_terminal_record":{"base_seeds":[1729,20260612,20260613,20260614,314159],"checkpoint_or_model_write_count":0,"completed_metric_ids":["expert_anchor_fidelity","membership_stability","deterministic_computational_cost_proxy"],"completed_semantics":"anfis_module_fit_only_not_downstream_ablation","completed_training_rows_per_module":[4096],"computational_cost_proxy":"deterministic_update_count_and_sample_count_no_wall_clock","downstream_blockers":["P0_model_unavailable","P1_model_unavailable"],"downstream_metrics_status":"not_estimable_without_separate_temporal_consumers","e7_fit_identity_key":["experiment_id","training_rows_per_module","base_seed","module_id"],"eligible_rows_by_module":{"ANFIS-F":35273,"ANFIS-N":4757,"ANFIS-T-no-current":35419},"exact_record_per_required_size":true,"expected_completed_module_fit_count":15,"expected_completed_slot_count":5,"expected_preflight_record_count":45,"expected_resource_failure_record_count":10,"expected_slot_count":15,"experiment_id":"E7","expert_anchor_band_boundaries":[0.0,0.3333333333333333,0.6666666666666666,1.0],"expert_anchor_band_labels":["low","middle","high"],"expert_anchor_band_target_scope":"per_target_module","family80_no_touch":true,"historical_blockers_adopted":[{"bytes":46105,"e7_learning_curve_sizes_authorized":"not_declared","e7_learning_curve_status":"blocked_pending_sampling_strata_contract","git_mode":"100644","git_oid":"5970ab73eedb20f464f804a185a3057daba93ab3","path":"configs/closure_v1/development_runtime.yaml","sha256":"0b2588248ee006f7d8e8843291b6a5847201a36fed35422473c9c0aa9492b10d"},{"bytes":22694,"e7_learning_curve_sizes_authorized":"not_declared","e7_learning_curve_status":"blocked_for_separate_gate","git_mode":"100644","git_oid":"94f84be4346fd4e01fd52d207b932e21022fc436","path":"configs/closure_v1/anfis_ablation_training_development_runtime.yaml","sha256":"cf2cec52d9027db895e8859c7ffb321c831b66510132e137759e567b363f6a50"},{"bytes":21827,"e7_learning_curve_sizes_authorized":false,"e7_learning_curve_status":"blocked_for_separate_gate","git_mode":"100644","git_oid":"f9956fb51a8b0a742831c3400cc9624f4369fe90","path":"configs/closure_v1/anfis_ablation_sequence_development_runtime.yaml","sha256":"49d1a3f562f2cd68ff65f29c92ac4e028b3ad407f30a9960ea0d29260df7d56b"}],"historical_e7_blocker_adopted":true,"holdout_group_id_derivation":"source_id_double_colon_site_id_verified_against_assignment","new_e7_fit_count":15,"preflight_module_count_per_slot":3,"prelock_status":"pending_authorized_terminalization","primary_4096_hash_rank_reuse_forbidden":true,"primary_fit_reuse_count":0,"primary_fit_scope":"hash_rank_not_reused","required_training_rows_per_module":[4096,16384,65536],"resource_failure_timing":"pre_fit_exact_eligibility_check","resource_failure_training_rows_per_module":[16384,65536],"retain_completed_sizes_without_post_hoc_substitution":true,"sampling_strata":["holdout_group_id","temporal_period","expert_anchor_band"],"saturation_claim_authorized_if_incomplete":false,"silent_omission_allowed":false,"stratum_derivation_evidence":"boundaries_maps_and_sha256_digests_required","supersession_scope":"e7_only_additive_authority","temporal_period_derivation":"ordered_unique_eligible_month_index_floor_3i_over_n","temporal_period_labels":["early","middle","late"],"temporal_period_target_scope":"per_target_module_after_eligibility_filter","terminal_statuses":["completed","resource_failure_recorded"],"wall_clock_metric_authoritative":false},"experiment_id":"closure_v1","failed_attempt":{"active_guard_count":0,"anfis_inference_slot_count":10,"attempted_gate":"E0-MCALG","authorization_consumed":true,"bundle_payload_built":false,"calibration_fit_performed":false,"compared_row_count":672,"dvc_commands_run":false,"failure_code":"a0_seed_1729_horizon_1_observed_risk_float32_precision_loss","filesystem_side_effect_count":0,"final_output_count":0,"first_failing_group":{"horizon_months":1,"model_id":"A0","model_seed":1729},"holdout_rows_opened":false,"model_inference_performed":true,"outcome_paths_opened":false,"phase":"normalized_calibration_frame_validation","post_2021_rows_opened":false,"precision_drift_by_horizon":{"1":90,"2":87,"3":84},"precision_drift_row_count":261,"retry_authorized":false,"scientific_input_reads_performed":true,"status":"failed_closed_no_outputs","temporary_output_count":0},"gate":"E0-MCALH","generated_at_utc":"2026-08-11T22:00:47.448631+00:00","h_patch":{"added_count":5,"component_count":9,"components":[{"bytes":13702,"git_mode":"100644","git_oid":"e48e1c02f62a80d58969540cf740aefab4c662f0","path":"configs/closure_v1/final_calibration_observed_risk_precision_patch_lock.schema.json","role":"final_calibration_observed_risk_precision_patch_component","sha256":"09aed7b296b5270af0305aec2576ebb425431c6ebdef7cc16b27e7ed2d382c8b"},{"bytes":9150,"git_mode":"100644","git_oid":"abd1913b4ded3087a92b7f48ac2850a8b62a9ba8","path":"docs/closure_v1/E0_M_FINAL_CALIBRATION_OBSERVED_RISK_PRECISION_PATCH_1.md","role":"final_calibration_observed_risk_precision_patch_component","sha256":"7279ff2955115910520e7726f291b9f07e667b2de58ebc7e58b11cee77c719a0"},{"bytes":164167,"git_mode":"100644","git_oid":"6a11c5e9c925e6c89e6619da1eb2c751b708e541","path":"src/experiments/calibrate_closure_final_models.py","role":"final_calibration_observed_risk_precision_patch_component","sha256":"c1f62b1fc7c837a2657fa2a9f5204ae26d74051116d38ab62ce19ee8143a0beb"},{"bytes":87701,"git_mode":"100644","git_oid":"6a60d6dd1f5b3f6a95bf86b403b68f768bd6d707","path":"src/experiments/closure_final_calibration_observed_risk_precision_patch.py","role":"final_calibration_observed_risk_precision_patch_component","sha256":"80b1724f1cd721cbcbaf429d69eb1b070c74e9ffada1b89a99137e0f88c47816"},{"bytes":9089,"git_mode":"100644","git_oid":"018de46b275134c2c9d83143c3cde84b42e46597","path":"src/experiments/lock_closure_final_calibration_observed_risk_precision_patch.py","role":"final_calibration_observed_risk_precision_patch_component","sha256":"82ecf9d369b62b487179aae2d2d3ef7f1e1c965a9b1498fcfe2a1d36fd26ddd4"},{"bytes":78293,"git_mode":"100644","git_oid":"242316a4da8f0147cc6baf941a33e94854aa21e3","path":"src/experiments/run_closure_anfis_learning_curve.py","role":"final_calibration_observed_risk_precision_patch_component","sha256":"e642febb0e0a1594d943ce80323df5d718354587b7b3fa7b5152942d54a27650"},{"bytes":109040,"git_mode":"100644","git_oid":"f6ffcc7057a06e83e02b7d70ff979d502850c561","path":"tests/test_calibrate_closure_final_models.py","role":"final_calibration_observed_risk_precision_patch_component","sha256":"9ff4902f179c69198e2b9cdc6856c9304d182737c37519c3b8acceba45a83434"},{"bytes":61601,"git_mode":"100644","git_oid":"3c47ff71adca7e587b7758292de009a48315da3e","path":"tests/test_closure_anfis_learning_curve.py","role":"final_calibration_observed_risk_precision_patch_component","sha256":"d24f36c60e43de87dc91c5ed309db646c745755c3779431cf516aa69bae097a3"},{"bytes":47044,"git_mode":"100644","git_oid":"d2d1b50c6787f213a4c463795060928547e1bf63","path":"tests/test_closure_final_calibration_observed_risk_precision_patch.py","role":"final_calibration_observed_risk_precision_patch_component","sha256":"61dc71a17d601d18389cf65931b694d1cd57cc7151d8414f8421f8cf284cc527"}],"components_sha256":"01a11a39e0a11907b28ccef2e062842904d97a4beeeb12b6c8f1f8ee4b2d4529","gate":"H-E0-MCALH","modified_count":4},"model_matrix":{"available_calibrable_count":6,"available_not_applicable_count":2,"model_count":11,"ordered_model_ids":["B0","B1","B2","F0","F1","P0","P1","M0","A0","A1","A2"],"records":[{"availability":"available","availability_reason":"published_deterministic_baseline","bloom_calibration":"fixed_identity_no_refit","bloom_score_source":"predicted_bloom_probability","calibration_seed_source":"technical_seed","horizons_months":[1,2,3],"model_id":"B0","ordinal_calibration":"record_not_available_degenerate_constant_score","seed_policy":"deterministic_technical_seed","seeds":[1729],"selected_family":false,"uncertainty_calibration":"not_applicable"},{"availability":"available","availability_reason":"published_seeded_baseline_family","bloom_calibration":"select_then_refit","bloom_score_source":"predicted_bloom_probability","calibration_seed_source":"upstream_state_seed","horizons_months":[1,2,3],"model_id":"B1","ordinal_calibration":"select_cutpoints","seed_policy":"exact_five_prespecified_seeds","seeds":[1729,20260612,20260613,20260614,314159],"selected_family":false,"uncertainty_calibration